### ISSUE TITLE
WireGuard on GCE not forwarding

### ISSUE THREAD

**Issue by x8x** [jlund/streisand#627]
Hello, I'm not sure if I'm missing something or there is a bug, after successful install, I can ping and connect to the server thru the tunnel but any other IP wont answer, I checked forwarding and it looks like enabled but it's a no go. Any idea welcome :-)

**Comment by jlund** [comment]
What distribution are you on?

**Comment by x8x** [comment]
Tried with LEDE nightly and Ubuntu 16.04.2 LTS

**Comment by x8x** [comment]
```
john@ubuntu:~$ ping -c 1 10.192.122.1
PING 10.192.122.1 (10.192.122.1) 56(84) bytes of data.
64 bytes from 10.192.122.1: icmp_seq=1 ttl=64 time=63.5 ms

--- 10.192.122.1 ping statistics ---
1 packets transmitted, 1 received, 0% packet loss, time 0ms
rtt min/avg/max/mdev = 63.581/63.581/63.581/0.000 ms
john@ubuntu:~$ tracepath 8.8.8.8
 1?: [LOCALHOST]                                         pmtu 1420
 1:  10.192.122.1                                         52.591ms 
 1:  10.192.122.1                                         63.825ms 
 2:  no reply
 3:  no reply
```

**Comment by zx2c4** [comment]
Is masquerading turned on on the server?

    # iptables -t nat -L -v

**Comment by x8x** [comment]
```
Chain PREROUTING (policy ACCEPT 11 packets, 664 bytes)
 pkts bytes target     prot opt in     out     source               destination         

Chain INPUT (policy ACCEPT 11 packets, 664 bytes)
 pkts bytes target     prot opt in     out     source               destination         

Chain OUTPUT (policy ACCEPT 165 packets, 10509 bytes)
 pkts bytes target     prot opt in     out     source               destination         

Chain POSTROUTING (policy ACCEPT 0 packets, 0 bytes)
 pkts bytes target     prot opt in     out     source               destination         
  165 10509 MASQUERADE  all  --  any    any     anywhere             anywhere            
    0     0 MASQUERADE  all  --  any    ens4    10.8.0.0/24          anywhere            
    0     0 MASQUERADE  all  --  any    ens4    10.9.0.0/24          anywhere            
```

**Comment by x8x** [comment]
```
john@ubuntu:~$ /etc/rc.local 
Warning: ignored obsolete keyword 'nat_traversal'
Warning: ignored obsolete keyword 'oe'
Warning: ignored obsolete keyword 'nat_traversal'
Warning: ignored obsolete keyword 'oe'
Warning: ignored obsolete keyword 'nat_traversal'
Warning: ignored obsolete keyword 'oe'
Redirecting to: systemctl start ipsec.service
[ ok ] Restarting xl2tpd (via systemctl): xl2tpd.service.
0
```
I switched order of rules in `/etc/rc.local` moving `WireGuard` rules before those of `L2TP/IPsec` like here:
```
# WireGuard
iptables -A FORWARD -s 10.192.122.0/24 -j ACCEPT
iptables -t nat -A POSTROUTING -s 10.192.122.0/24 -o ens4 -j MASQUERADE

# L2TP/IPsec
iptables -A INPUT -m conntrack --ctstate RELATED,ESTABLISHED -j ACCEPT
iptables -A INPUT -i lo -j ACCEPT
iptables -A INPUT -p udp --dport 67:68 --sport 67:68 -j ACCEPT
iptables -A INPUT -p udp -m multiport --dports 500,4500 -j ACCEPT
iptables -A INPUT -p udp --dport 1701 -m policy --dir in --pol ipsec -j ACCEPT
iptables -A INPUT -p udp --dport 1701 -j DROP
iptables -A FORWARD -i eth+ -o ppp+ -m conntrack --ctstate RELATED,ESTABLISHED -j ACCEPT
iptables -A FORWARD -i ppp+ -o eth+ -j ACCEPT
iptables -t nat -A POSTROUTING -s 192.168.42.0/24 -o eth+ -j SNAT --to-source 10.148.0.2
```
Now after reboot `iptables -t nat -L -v` shows:
```
...
Chain POSTROUTING (policy ACCEPT 0 packets, 0 bytes)
 pkts bytes target     prot opt in     out     source               destination         
  139  8692 MASQUERADE  all  --  any    any     anywhere             anywhere            
    0     0 MASQUERADE  all  --  any    ens4    10.8.0.0/24          anywhere            
    0     0 MASQUERADE  all  --  any    ens4    10.9.0.0/24          anywhere            
    0     0 MASQUERADE  all  --  any    ens4    10.192.122.0/24      anywhere            
```
SO masquerade rule is there now but still something is missing, can't ping other IPs thru tunnel.

**Comment by x8x** [comment]
@zx2c4 That is after I switched order in `rc.local` (see above):
```
john@ubuntu:~$ iptables -t nat -L -v -n
Chain PREROUTING (policy ACCEPT 2662 packets, 1870K bytes)
 pkts bytes target     prot opt in     out     source               destination         

Chain INPUT (policy ACCEPT 86 packets, 5491 bytes)
 pkts bytes target     prot opt in     out     source               destination         

Chain OUTPUT (policy ACCEPT 2205 packets, 132K bytes)
 pkts bytes target     prot opt in     out     source               destination         

Chain POSTROUTING (policy ACCEPT 0 packets, 0 bytes)
 pkts bytes target     prot opt in     out     source               destination         
 2378  158K MASQUERADE  all  --  *      *       0.0.0.0/0            0.0.0.0/0           
    0     0 MASQUERADE  all  --  *      ens4    10.8.0.0/24          0.0.0.0/0           
    0     0 MASQUERADE  all  --  *      ens4    10.9.0.0/24          0.0.0.0/0           
    0     0 MASQUERADE  all  --  *      ens4    10.192.122.0/24      0.0.0.0/0           
john@ubuntu:~$ iptables -L -v -n
Chain INPUT (policy DROP 0 packets, 0 bytes)
 pkts bytes target     prot opt in     out     source               destination         
19781 6875K sshguard   all  --  *      *       0.0.0.0/0            0.0.0.0/0           
19834 6885K ufw-before-logging-input  all  --  *      *       0.0.0.0/0            0.0.0.0/0           
19834 6885K ufw-before-input  all  --  *      *       0.0.0.0/0            0.0.0.0/0           
 2403 1838K ufw-after-input  all  --  *      *       0.0.0.0/0            0.0.0.0/0           
 2403 1838K ufw-after-logging-input  all  --  *      *       0.0.0.0/0            0.0.0.0/0           
 2403 1838K ufw-reject-input  all  --  *      *       0.0.0.0/0            0.0.0.0/0           
 2403 1838K ufw-track-input  all  --  *      *       0.0.0.0/0            0.0.0.0/0           
    0     0 ACCEPT     all  --  *      *       0.0.0.0/0            0.0.0.0/0            ctstate RELATED,ESTABLISHED
    0     0 ACCEPT     all  --  lo     *       0.0.0.0/0            0.0.0.0/0           
    0     0 ACCEPT     udp  --  *      *       0.0.0.0/0            0.0.0.0/0            udp spts:67:68 dpts:67:68
    0     0 ACCEPT     udp  --  *      *       0.0.0.0/0            0.0.0.0/0            multiport dports 500,4500

Chain FORWARD (policy ACCEPT 0 packets, 0 bytes)
 pkts bytes target     prot opt in     out     source               destination         
 2250  251K ufw-before-logging-forward  all  --  *      *       0.0.0.0/0            0.0.0.0/0           
 2250  251K ufw-before-forward  all  --  *      *       0.0.0.0/0            0.0.0.0/0           
 1012  147K ufw-after-forward  all  --  *      *       0.0.0.0/0            0.0.0.0/0           
 1012  147K ufw-after-logging-forward  all  --  *      *       0.0.0.0/0            0.0.0.0/0           
 1012  147K ufw-reject-forward  all  --  *      *       0.0.0.0/0            0.0.0.0/0           
 1012  147K ufw-track-forward  all  --  *      *       0.0.0.0/0            0.0.0.0/0           
    0     0 ACCEPT     all  --  *      *       0.0.0.0/0            0.0.0.0/0            state RELATED,ESTABLISHED
    0     0 ACCEPT     all  --  *      *       10.8.0.0/24          0.0.0.0/0           
    0     0 ACCEPT     all  --  *      *       10.9.0.0/24          0.0.0.0/0           
    6   312 ACCEPT     all  --  *      *       10.192.122.0/24      0.0.0.0/0           

Chain OUTPUT (policy ACCEPT 1 packets, 84 bytes)
 pkts bytes target     prot opt in     out     source               destination         
14718 2975K ufw-before-logging-output  all  --  *      *       0.0.0.0/0            0.0.0.0/0           
14718 2975K ufw-before-output  all  --  *      *       0.0.0.0/0            0.0.0.0/0           
  513 27284 ufw-after-output  all  --  *      *       0.0.0.0/0            0.0.0.0/0           
  513 27284 ufw-after-logging-output  all  --  *      *       0.0.0.0/0            0.0.0.0/0           
  513 27284 ufw-reject-output  all  --  *      *       0.0.0.0/0            0.0.0.0/0           
  513 27284 ufw-track-output  all  --  *      *       0.0.0.0/0            0.0.0.0/0           

Chain sshguard (1 references)
 pkts bytes target     prot opt in     out     source               destination         

Chain ufw-after-forward (1 references)
 pkts bytes target     prot opt in     out     source               destination         

Chain ufw-after-input (1 references)
 pkts bytes target     prot opt in     out     source               destination         
    0     0 ufw-skip-to-policy-input  udp  --  *      *       0.0.0.0/0            0.0.0.0/0            udp dpt:137
    0     0 ufw-skip-to-policy-input  udp  --  *      *       0.0.0.0/0            0.0.0.0/0            udp dpt:138
    0     0 ufw-skip-to-policy-input  tcp  --  *      *       0.0.0.0/0            0.0.0.0/0            tcp dpt:139
    0     0 ufw-skip-to-policy-input  tcp  --  *      *       0.0.0.0/0            0.0.0.0/0            tcp dpt:445
    0     0 ufw-skip-to-policy-input  udp  --  *      *       0.0.0.0/0            0.0.0.0/0            udp dpt:67
    0     0 ufw-skip-to-policy-input  udp  --  *      *       0.0.0.0/0            0.0.0.0/0            udp dpt:68
    0     0 ufw-skip-to-policy-input  all  --  *      *       0.0.0.0/0            0.0.0.0/0            ADDRTYPE match dst-type BROADCAST

Chain ufw-after-logging-forward (1 references)
 pkts bytes target     prot opt in     out     source               destination         
  565 44528 LOG        all  --  *      *       0.0.0.0/0            0.0.0.0/0            LOG flags 0 level 4 prefix "[UFW ALLOW] "

Chain ufw-after-logging-input (1 references)
 pkts bytes target     prot opt in     out     source               destination         
    0     0 LOG        all  --  *      *       0.0.0.0/0            0.0.0.0/0            LOG flags 0 level 4 prefix "[UFW BLOCK] "

Chain ufw-after-logging-output (1 references)
 pkts bytes target     prot opt in     out     source               destination         
  356 18503 LOG        all  --  *      *       0.0.0.0/0            0.0.0.0/0            LOG flags 0 level 4 prefix "[UFW ALLOW] "

Chain ufw-after-output (1 references)
 pkts bytes target     prot opt in     out     source               destination         

Chain ufw-before-forward (1 references)
 pkts bytes target     prot opt in     out     source               destination         
    0     0 ACCEPT     all  --  *      *       0.0.0.0/0            0.0.0.0/0            ctstate RELATED,ESTABLISHED
    0     0 ACCEPT     icmp --  *      *       0.0.0.0/0            0.0.0.0/0            icmptype 3
    0     0 ACCEPT     icmp --  *      *       0.0.0.0/0            0.0.0.0/0            icmptype 4
    0     0 ACCEPT     icmp --  *      *       0.0.0.0/0            0.0.0.0/0            icmptype 11
    0     0 ACCEPT     icmp --  *      *       0.0.0.0/0            0.0.0.0/0            icmptype 12
 1238  104K ACCEPT     icmp --  *      *       0.0.0.0/0            0.0.0.0/0            icmptype 8
 1012  147K ufw-user-forward  all  --  *      *       0.0.0.0/0            0.0.0.0/0           

Chain ufw-before-input (1 references)
 pkts bytes target     prot opt in     out     source               destination         
 9221 1142K ACCEPT     all  --  lo     *       0.0.0.0/0            0.0.0.0/0           
 8107 3898K ACCEPT     all  --  *      *       0.0.0.0/0            0.0.0.0/0            ctstate RELATED,ESTABLISHED
    7   316 ufw-logging-deny  all  --  *      *       0.0.0.0/0            0.0.0.0/0            ctstate INVALID
    7   316 DROP       all  --  *      *       0.0.0.0/0            0.0.0.0/0            ctstate INVALID
    0     0 ACCEPT     icmp --  *      *       0.0.0.0/0            0.0.0.0/0            icmptype 3
    0     0 ACCEPT     icmp --  *      *       0.0.0.0/0            0.0.0.0/0            icmptype 4
    0     0 ACCEPT     icmp --  *      *       0.0.0.0/0            0.0.0.0/0            icmptype 11
    0     0 ACCEPT     icmp --  *      *       0.0.0.0/0            0.0.0.0/0            icmptype 12
    1    84 ACCEPT     icmp --  *      *       0.0.0.0/0            0.0.0.0/0            icmptype 8
    0     0 ACCEPT     udp  --  *      *       0.0.0.0/0            0.0.0.0/0            udp spt:67 dpt:68
 2498 1846K ufw-not-local  all  --  *      *       0.0.0.0/0            0.0.0.0/0           
    0     0 ACCEPT     udp  --  *      *       0.0.0.0/0            224.0.0.251          udp dpt:5353
    0     0 ACCEPT     udp  --  *      *       0.0.0.0/0            239.255.255.250      udp dpt:1900
 2498 1846K ufw-user-input  all  --  *      *       0.0.0.0/0            0.0.0.0/0           

Chain ufw-before-logging-forward (1 references)
 pkts bytes target     prot opt in     out     source               destination         
  150 11982 LOG        all  --  *      *       0.0.0.0/0            0.0.0.0/0            limit: avg 3/min burst 10 LOG flags 0 level 4 prefix "[UFW AUDIT] "

Chain ufw-before-logging-input (1 references)
 pkts bytes target     prot opt in     out     source               destination         
  158 22305 LOG        all  --  *      *       0.0.0.0/0            0.0.0.0/0            limit: avg 3/min burst 10 LOG flags 0 level 4 prefix "[UFW AUDIT] "

Chain ufw-before-logging-output (1 references)
 pkts bytes target     prot opt in     out     source               destination         
  158 49595 LOG        all  --  *      *       0.0.0.0/0            0.0.0.0/0            limit: avg 3/min burst 10 LOG flags 0 level 4 prefix "[UFW AUDIT] "

Chain ufw-before-output (1 references)
 pkts bytes target     prot opt in     out     source               destination         
 9221 1142K ACCEPT     all  --  *      lo      0.0.0.0/0            0.0.0.0/0           
 4984 1806K ACCEPT     all  --  *      *       0.0.0.0/0            0.0.0.0/0            ctstate RELATED,ESTABLISHED
  513 27284 ufw-user-output  all  --  *      *       0.0.0.0/0            0.0.0.0/0           

Chain ufw-logging-allow (0 references)
 pkts bytes target     prot opt in     out     source               destination         
    0     0 LOG        all  --  *      *       0.0.0.0/0            0.0.0.0/0            LOG flags 0 level 4 prefix "[UFW ALLOW] "

Chain ufw-logging-deny (2 references)
 pkts bytes target     prot opt in     out     source               destination         
    1    76 LOG        all  --  *      *       0.0.0.0/0            0.0.0.0/0            ctstate INVALID LOG flags 0 level 4 prefix "[UFW AUDIT INVALID] "
    1    76 LOG        all  --  *      *       0.0.0.0/0            0.0.0.0/0            LOG flags 0 level 4 prefix "[UFW BLOCK] "

Chain ufw-not-local (1 references)
 pkts bytes target     prot opt in     out     source               destination         
 2498 1846K RETURN     all  --  *      *       0.0.0.0/0            0.0.0.0/0            ADDRTYPE match dst-type LOCAL
    0     0 RETURN     all  --  *      *       0.0.0.0/0            0.0.0.0/0            ADDRTYPE match dst-type MULTICAST
    0     0 RETURN     all  --  *      *       0.0.0.0/0            0.0.0.0/0            ADDRTYPE match dst-type BROADCAST
    0     0 ufw-logging-deny  all  --  *      *       0.0.0.0/0            0.0.0.0/0            limit: avg 3/min burst 10
    0     0 DROP       all  --  *      *       0.0.0.0/0            0.0.0.0/0           

Chain ufw-reject-forward (1 references)
 pkts bytes target     prot opt in     out     source               destination         

Chain ufw-reject-input (1 references)
 pkts bytes target     prot opt in     out     source               destination         

Chain ufw-reject-output (1 references)
 pkts bytes target     prot opt in     out     source               destination         

Chain ufw-skip-to-policy-forward (0 references)
 pkts bytes target     prot opt in     out     source               destination         
    0     0 ACCEPT     all  --  *      *       0.0.0.0/0            0.0.0.0/0           

Chain ufw-skip-to-policy-input (7 references)
 pkts bytes target     prot opt in     out     source               destination         
    0     0 DROP       all  --  *      *       0.0.0.0/0            0.0.0.0/0           

Chain ufw-skip-to-policy-output (0 references)
 pkts bytes target     prot opt in     out     source               destination         
    0     0 ACCEPT     all  --  *      *       0.0.0.0/0            0.0.0.0/0           

Chain ufw-track-forward (1 references)
 pkts bytes target     prot opt in     out     source               destination         
  871 70688 ACCEPT     tcp  --  *      *       0.0.0.0/0            0.0.0.0/0            ctstate NEW
  135 76258 ACCEPT     udp  --  *      *       0.0.0.0/0            0.0.0.0/0            ctstate NEW

Chain ufw-track-input (1 references)
 pkts bytes target     prot opt in     out     source               destination         

Chain ufw-track-output (1 references)
 pkts bytes target     prot opt in     out     source               destination         
  224 13440 ACCEPT     tcp  --  *      *       0.0.0.0/0            0.0.0.0/0            ctstate NEW
  288 13760 ACCEPT     udp  --  *      *       0.0.0.0/0            0.0.0.0/0            ctstate NEW

Chain ufw-user-forward (1 references)
 pkts bytes target     prot opt in     out     source               destination         

Chain ufw-user-input (1 references)
 pkts bytes target     prot opt in     out     source               destination         
   41  2388 ACCEPT     tcp  --  *      *       0.0.0.0/0            0.0.0.0/0            tcp dpt:22
    0     0 ACCEPT     udp  --  *      *       0.0.0.0/0            0.0.0.0/0            udp dpt:500
    0     0 ACCEPT     udp  --  *      *       0.0.0.0/0            0.0.0.0/0            udp dpt:1701
    0     0 ACCEPT     udp  --  *      *       0.0.0.0/0            0.0.0.0/0            udp dpt:4500
    3   140 ACCEPT     tcp  --  *      *       0.0.0.0/0            0.0.0.0/0            tcp dpt:443
    0     0 ACCEPT     udp  --  *      *       192.168.1.0/24       0.0.0.0/0            udp dpt:53
    0     0 ACCEPT     tcp  --  *      *       0.0.0.0/0            0.0.0.0/0            tcp dpt:4443
    0     0 ACCEPT     udp  --  *      *       0.0.0.0/0            0.0.0.0/0            udp dpt:4443
    0     0 ACCEPT     udp  --  *      *       10.8.0.0/24          0.0.0.0/0            udp dpt:53
    0     0 ACCEPT     udp  --  *      *       10.9.0.0/24          0.0.0.0/0            udp dpt:53
    0     0 ACCEPT     tcp  --  *      *       0.0.0.0/0            0.0.0.0/0            tcp dpt:636
    0     0 ACCEPT     udp  --  *      *       0.0.0.0/0            0.0.0.0/0            udp dpt:8757
    0     0 ACCEPT     tcp  --  *      *       0.0.0.0/0            0.0.0.0/0            tcp dpt:8530
    0     0 ACCEPT     udp  --  *      *       0.0.0.0/0            0.0.0.0/0            udp dpt:8530
    3   140 ACCEPT     tcp  --  *      *       0.0.0.0/0            0.0.0.0/0            tcp dpt:993
   33  1968 ACCEPT     tcp  --  *      *       0.0.0.0/0            0.0.0.0/0            tcp dpt:8443
    0     0 ACCEPT     tcp  --  *      *       0.0.0.0/0            0.0.0.0/0            tcp dpt:9443
    1    67 ACCEPT     udp  --  *      *       10.192.122.0/24      0.0.0.0/0            udp dpt:53
   14  2464 ACCEPT     udp  --  *      *       0.0.0.0/0            0.0.0.0/0            udp dpt:51820

Chain ufw-user-limit (0 references)
 pkts bytes target     prot opt in     out     source               destination         
    0     0 LOG        all  --  *      *       0.0.0.0/0            0.0.0.0/0            limit: avg 3/min burst 5 LOG flags 0 level 4 prefix "[UFW LIMIT BLOCK] "
    0     0 REJECT     all  --  *      *       0.0.0.0/0            0.0.0.0/0            reject-with icmp-port-unreachable

Chain ufw-user-limit-accept (0 references)
 pkts bytes target     prot opt in     out     source               destination         
    0     0 ACCEPT     all  --  *      *       0.0.0.0/0            0.0.0.0/0           

Chain ufw-user-logging-forward (0 references)
 pkts bytes target     prot opt in     out     source               destination         

Chain ufw-user-logging-input (0 references)
 pkts bytes target     prot opt in     out     source               destination         

Chain ufw-user-logging-output (0 references)
 pkts bytes target     prot opt in     out     source               destination         

Chain ufw-user-output (1 references)
 pkts bytes target     prot opt in     out     source               destination         
john@ubuntu:~$ cat /proc/sys/net/ipv4/ip_forward
1
john@ubuntu:~$ cat /sys/module/wireguard/version
0.0.20170409

```

**Comment by x8x** [comment]
Just made a fresh install.

########################################
## After fresh install:
Output of:
```
iptables -t nat -L -v -n
iptables -L -v -n
cat /proc/sys/net/ipv4/ip_forward
cat /sys/module/wireguard/version
```
https://pastebin.com/raw/YdQ8Gy5p

Output of `systemctl`:
https://pastebin.com/raw/ckhLZ3T5

Output of `systemctl status`:
https://pastebin.com/raw/CWbYJ4n2

########################################
## After fresh install and reboot:
Output of:
```
iptables -t nat -L -v -n
iptables -L -v -n
cat /proc/sys/net/ipv4/ip_forward
cat /sys/module/wireguard/version
```
https://pastebin.com/raw/4yqtMtei

Output of `systemctl`:
https://pastebin.com/raw/3Wta71ZS

Output of `systemctl status`:
https://pastebin.com/raw/r58H5f2F

**Comment by zx2c4** [comment]
Thanks. Sorry one more command: `ip addr`

**Comment by x8x** [comment]
```
# ip addr
1: lo: <LOOPBACK,UP,LOWER_UP> mtu 65536 qdisc noqueue state UNKNOWN group default qlen 1
    link/loopback 00:00:00:00:00:00 brd 00:00:00:00:00:00
    inet 127.0.0.1/8 scope host lo
       valid_lft forever preferred_lft forever
    inet6 ::1/128 scope host 
       valid_lft forever preferred_lft forever
2: ens4: <BROADCAST,MULTICAST,UP,LOWER_UP> mtu 1460 qdisc pfifo_fast state UP group default qlen 1000
    link/ether 42:01:0a:94:00:02 brd ff:ff:ff:ff:ff:ff
    inet 10.148.0.2/32 brd 10.148.0.2 scope global ens4
       valid_lft forever preferred_lft forever
    inet6 fe80::4001:aff:fe94:2/64 scope link 
       valid_lft forever preferred_lft forever
3: tun0: <POINTOPOINT,MULTICAST,NOARP,UP,LOWER_UP> mtu 1500 qdisc pfifo_fast state UNKNOWN group default qlen 100
    link/none 
    inet 10.8.0.1 peer 10.8.0.2/32 scope global tun0
       valid_lft forever preferred_lft forever
    inet6 fe80::9d35:7bcf:2405:ae1/64 scope link flags 800 
       valid_lft forever preferred_lft forever
4: wg0-server: <POINTOPOINT,NOARP,UP,LOWER_UP> mtu 1420 qdisc noqueue state UNKNOWN group default qlen 1
    link/none 
    inet 10.192.122.1/24 scope global wg0-server
       valid_lft forever preferred_lft forever
5: tun1: <POINTOPOINT,MULTICAST,NOARP,UP,LOWER_UP> mtu 1500 qdisc pfifo_fast state UNKNOWN group default qlen 100
    link/none 
    inet 10.9.0.1 peer 10.9.0.2/32 scope global tun1
       valid_lft forever preferred_lft forever
    inet6 fe80::1a08:3269:b995:ae7a/64 scope link flags 800 
       valid_lft forever preferred_lft forever
6: ip_vti0@NONE: <NOARP> mtu 1332 qdisc noop state DOWN group default qlen 1
    link/ipip 0.0.0.0 brd 0.0.0.0
```

**Comment by CorbanR** [comment]
@zx2c4 I have a fairly fresh GCE instance you can use to troubleshoot if you would like. Just send me your public key and I can add it.

**Comment by zx2c4** [comment]
A little-known Github trick allows for this: https://github.com/zx2c4.keys

I'll be back in ~10 hours and will take a look.

**Comment by CorbanR** [comment]
TIL, thanks! 
Keys has been added to `ubuntu@35.185.199.217` feel free to do whatever you want with this sever.

This may or may not matter, but after reading the backlog again, I started looking at the GCE module we use. The module has an `ip_forward ` options which is disabled by default.  https://docs.ansible.com/ansible/gce_module.html. I can enable that and spin up a new server if needed.

**Comment by x8x** [comment]
Tried that without success, maybe worth a retry as by the time I had already messed up the firewall rules. Thought it should run NATed like L2TP and openvpn which I tried and works fine with the GCE instance forwarding option turned off.
With tcpdump, I couldn't see traffic coming from wg0-server go to es4, also worth a retest.

**Comment by x8x** [comment]
Just updated client and server to WG 0.0.20170421, NAT seams to be working now, but the firewall seams to be blocking:
```
# journalctl -xf
Apr 21 19:22:23 streisand kernel: [UFW AUDIT] IN=wg0-server OUT=ens4 MAC= SRC=10.192.122.2 DST=8.8.8.8 LEN=84 TOS=0x00 PREC=0x00 TTL=63 ID=34008 DF PROTO=ICMP TYPE=8 CODE=0 ID=4787 SEQ=12 
Apr 21 19:22:24 streisand kernel: [UFW AUDIT] IN=wg0-server OUT=ens4 MAC= SRC=10.192.122.2 DST=8.8.8.8 LEN=84 TOS=0x00 PREC=0x00 TTL=63 ID=34192 DF PROTO=ICMP TYPE=8 CODE=0 ID=4787 SEQ=13 
Apr 21 19:22:25 streisand kernel: [UFW AUDIT] IN=wg0-server OUT=ens4 MAC= SRC=10.192.122.2 DST=8.8.8.8 LEN=84 TOS=0x00 PREC=0x00 TTL=63 ID=34234 DF PROTO=ICMP TYPE=8 CODE=0 ID=4787 SEQ=14 
Apr 21 19:22:26 streisand kernel: [UFW AUDIT] IN=wg0-server OUT=ens4 MAC= SRC=10.192.122.2 DST=8.8.8.8 LEN=84 TOS=0x00 PREC=0x00 TTL=63 ID=34291 DF PROTO=ICMP TYPE=8 CODE=0 ID=4787 SEQ=15 

# tcpdump -i ens4 not port 22
19:22:23.253165 IP 10.148.0.2 > google-public-dns-a.google.com: ICMP echo request, id 4787, seq 12, length 64
19:22:24.245219 IP 10.148.0.2 > google-public-dns-a.google.com: ICMP echo request, id 4787, seq 13, length 64
19:22:25.241188 IP 10.148.0.2 > google-public-dns-a.google.com: ICMP echo request, id 4787, seq 14, length 64
19:22:26.241714 IP 10.148.0.2 > google-public-dns-a.google.com: ICMP echo request, id 4787, seq 15, length 64
```

**Comment by zx2c4** [comment]
I figured it out, and it's extremely low level. I'm following up with the relevant parties and will report here once it's fixed.

**Comment by x8x** [comment]
Thank you @zx2c4 for taking care of it! Yours is an amazing project! Streisand as well! :-)

**Comment by zx2c4** [comment]
Looks like upstream fixed this problem, kernel.org's stable kernels fixed this problem, but Ubuntu forgot to backport the fixes.

Please "vote" on this issue if you'd like it to be fixed: https://bugs.launchpad.net/ubuntu/+source/linux/+bug/1685416

**Comment by cpu** [comment]
@zx2c4 Do you think its worth conditionally skipping Streisand's Wireguard role on GCE until the required patches are backported?

**Comment by zx2c4** [comment]
Give them til Tuesday to respond, and then we'll see what to do. I suspect there will be a fairly quick cycle for fixing this, since Google Cloud platform is a big customer, and breaking stuff for them isn't good.

**Comment by x8x** [comment]
In the meantime you can get WG working on GCE by installing any of these:
`linux-generic-hwe-16.04-edge`
`linux-lowlatency-hwe-16.04-edge` ( @zx2c4 any advantage running this one? )

**Comment by zx2c4** [comment]
The Ubuntu kernel guy wrote:

> Hi Jason, actually we found out that someone else already had been requesting those changes last week. It was decided that it is better to get these changes out quickly so it should be in the next few days. I will mark your report as a duplicate to the older age report.

Prior bug report is here: https://bugs.launchpad.net/ubuntu/+source/linux/+bug/1683947

**Comment by zx2c4** [comment]
I'm pretty sure this should be fixed by now. Can somebody test with a fresh instance and report back?

**Comment by cpu** [comment]
I have a fresh GCE instance coming up now. Will report back in a short while.

**Comment by cpu** [comment]
I was able to confirm that Wireguard appears to be working fine with a fresh GCE instance. I was able to route test traffic through the Wireguard interface without issue. 

Thanks everyone! I'm going to close this issue - please open a new issue if you run into any further problems.
